{
  "schema_version": 1, "id": "language.voice-profile-extraction",
  "query": "Analyze these twenty founder emails and create a reusable voice profile with behavioral rules, boundaries, and examples. Do not draft a new email.",
  "expected_primary": "resonance-ops-voice", "allowed_contributors": [],
  "forbidden_skills": ["resonance-marketing-copywriter"], "harm_tier": "STANDARD", "cluster": "voice-copywriter",
  "rationale": "Voice owns corpus-based profile extraction; Copywriter owns applying a profile to copy.",
  "expected_activation_mode": "AUTO", "ambiguity_behavior": "ROUTE",
  "deterministic_checks": [{"kind": "primary_is", "value": "resonance-ops-voice"}]
}
