{
  "schema_version": 1, "id": "sales.pipeline-current-view",
  "query": "Load this deal export and show current pipeline velocity, stale deals, rep attainment, and this month's forecast in an interactive dashboard.",
  "expected_primary": "resonance-sales-pipeline", "allowed_contributors": [],
  "forbidden_skills": ["resonance-sales-revops"], "harm_tier": "STANDARD", "cluster": "pipeline-revops",
  "rationale": "Pipeline owns deal-level ingestion, current analysis, and dashboard output.",
  "expected_activation_mode": "AUTO", "ambiguity_behavior": "ROUTE",
  "deterministic_checks": [{"kind": "primary_is", "value": "resonance-sales-pipeline"}]
}
