{
  "schema_version": 1, "id": "operations.core-project-init",
  "query": "Initialize Resonance in this new adopter project and create the public project-state and memory scaffold.",
  "expected_primary": "resonance-ops-core", "allowed_contributors": [],
  "forbidden_skills": ["resonance-strategy-brief", "resonance-ops-goal"], "harm_tier": "STANDARD", "cluster": "core-boundary",
  "rationale": "Core owns project initialization and project-owned state, not general routing or delivery.",
  "expected_activation_mode": "AUTO", "ambiguity_behavior": "ROUTE",
  "deterministic_checks": [{"kind": "primary_is", "value": "resonance-ops-core"}]
}
